<?xml version="1.0" encoding="UTF-8"?>
<deposits xmlns:xs="http://www.w3.org/2001/XMLSchema-instance"
				xs:noNamespaceSchemaLocation="deposits.xsd">
	<on-demand-deposit account-id="462050507008506950">
		<bank-name>Absolutbank</bank-name>
        <country>BY</country>
        <depositor>Sytsevich Siarhei</depositor>
		<amount-on-deposit>10000</amount-on-deposit>
		<profitability>15.375</profitability>
	</on-demand-deposit>
    <metal-deposit account-id="462050507008506951">
		<bank-name>Absolutbank</bank-name>
        <country>RU</country>
        <depositor>Andreas Bollermann</depositor>
		<amount-on-deposit>0.00</amount-on-deposit>
		<profitability>0.000</profitability>
		<metals>
			<metal>
				<metal-nomenclature>Ag</metal-nomenclature>
				<weight>15</weight>
				<metal-purchase-rate>77.17</metal-purchase-rate>
			</metal>
			<metal>
				<metal-nomenclature>Pd</metal-nomenclature>
				<weight>8.5</weight>
				<metal-purchase-rate>1777.17</metal-purchase-rate>
			</metal>
		</metals>
	</metal-deposit>
    <saving-deposit account-id="462050507008506952" deposit-callable="false" withdrawal-callable="false">
		<bank-name>Alpha-Bank</bank-name>
        <country>LT</country>
        <depositor>Sytsevichus Siarheis</depositor>
		<amount-on-deposit>1000</amount-on-deposit>
		<profitability>10.5</profitability>
		<time-constraints>2023-04-20</time-constraints>
	</saving-deposit>
    <accumulation-deposit account-id="462050507008506953" withdrawal-callable="false">
		<bank-name>SberBank</bank-name>
        <country>LV</country>
        <depositor>Sytsevichs Siarheis</depositor>
		<amount-on-deposit>100000</amount-on-deposit>
		<profitability>6.5</profitability>
		<time-constraints>2023-04-20</time-constraints>
		<date-until-replenishment-allowed>2023-03-20</date-until-replenishment-allowed>
	</accumulation-deposit>
    <checkin-deposit account-id="462050507008506954" withdrawal-callable="false">
		<bank-name>SberBank</bank-name>
        <country>RU</country>
        <depositor>Сыцевич Сергей</depositor>
		<amount-on-deposit>100000</amount-on-deposit>
		<profitability>6.5</profitability>
		<time-constraints>2023-04-20</time-constraints>
		<irreducible-balance>1000</irreducible-balance>
    </checkin-deposit>
    <express-deposit account-id="462050507008506955" deposit-callable="false">
		<bank-name>SberBank</bank-name>
        <country>BY</country>
        <depositor>Sytsevich Siarhei Vasilijevich</depositor>
		<amount-on-deposit>1000</amount-on-deposit>
		<profitability>0.000</profitability>
		<time-constraints>2023-04-20</time-constraints>
	</express-deposit>
    <on-demand-deposit account-id="462050507008506956">
		<bank-name>SberBank</bank-name>
        <country>UA</country>
        <depositor>Sytsevich Paul</depositor>
		<amount-on-deposit>10000</amount-on-deposit>
		<profitability>15.375</profitability>
	</on-demand-deposit>
    <metal-deposit account-id="462050507008506957">
		<bank-name>Absolutbank</bank-name>
        <country>RU</country>
        <depositor>Fedos Bollermann</depositor>
		<amount-on-deposit>0.00</amount-on-deposit>
		<profitability>0.000</profitability>
		<metals>
			<metal>
				<metal-nomenclature>Au</metal-nomenclature>
				<weight>2.5</weight>
				<metal-purchase-rate>2977.17</metal-purchase-rate>
			</metal>
			<metal>
				<metal-nomenclature>Pt</metal-nomenclature>
				<weight>6.5</weight>
				<metal-purchase-rate>2077.17</metal-purchase-rate>
			</metal>
		</metals>
	</metal-deposit>
    <saving-deposit account-id="462050507008506958" deposit-callable="false" withdrawal-callable="false">
		<bank-name>Tecnobank</bank-name>
        <country>DE</country>
        <depositor>Sytsevichus Siarheis</depositor>
		<amount-on-deposit>1000</amount-on-deposit>
		<profitability>10.5</profitability>
		<time-constraints>2023-04-20</time-constraints>
	</saving-deposit>
    <accumulation-deposit account-id="462050507008506959" withdrawal-callable="false">
		<bank-name>BankWTB</bank-name>
        <country>US</country>
        <depositor>Sytsevichs Siarheis</depositor>
		<amount-on-deposit>100000</amount-on-deposit>
		<profitability>6.5</profitability>
		<time-constraints>2023-04-20</time-constraints>
		<date-until-replenishment-allowed>2023-03-20</date-until-replenishment-allowed>
	</accumulation-deposit>
    <checkin-deposit account-id="462050507008506960" withdrawal-callable="false">
		<bank-name>SberBank</bank-name>
        <country>RU</country>
        <depositor>Сыцевич Сергей</depositor>
		<amount-on-deposit>100001</amount-on-deposit>
		<profitability>6.5</profitability>
		<time-constraints>2023-04-20</time-constraints>
		<irreducible-balance>1001</irreducible-balance>
    </checkin-deposit>
    <express-deposit account-id="462050507008506961" deposit-callable="false">
		<bank-name>BankBelWEB</bank-name>
        <country>BY</country>
        <depositor>Sytsevich Siarhei Vasilijevich</depositor>
		<amount-on-deposit>1000</amount-on-deposit>
		<profitability>0.000</profitability>
		<time-constraints>2023-04-20</time-constraints>
	</express-deposit>
	<on-demand-deposit account-id="462050507008506962">
		<bank-name>SberBank</bank-name>
        <country>UA</country>
        <depositor>Sytsevich Max</depositor>
		<amount-on-deposit>10000</amount-on-deposit>
		<profitability>15.375</profitability>
	</on-demand-deposit>
    <metal-deposit account-id="462050507008506963">
		<bank-name>Absolutbank</bank-name>
        <country>PL</country>
        <depositor>Morduhei Bollermann</depositor>
		<amount-on-deposit>0.00</amount-on-deposit>
		<profitability>0.000</profitability>
		<metals>
			<metal>
				<metal-nomenclature>Au</metal-nomenclature>
				<weight>2.5</weight>
				<metal-purchase-rate>2977.17</metal-purchase-rate>
			</metal>
			<metal>
				<metal-nomenclature>Pd</metal-nomenclature>
				<weight>6.5</weight>
				<metal-purchase-rate>1777.17</metal-purchase-rate>
			</metal>
		</metals>
	</metal-deposit>
    <saving-deposit account-id="462050507008506964" deposit-callable="false" withdrawal-callable="false">
		<bank-name>Tecnobank</bank-name>
        <country>DE</country>
        <depositor>Sytsevichus Siarheis</depositor>
		<amount-on-deposit>1000</amount-on-deposit>
		<profitability>10.5</profitability>
		<time-constraints>2023-04-20</time-constraints>
	</saving-deposit>
    <accumulation-deposit account-id="462050507008506965" withdrawal-callable="false">
		<bank-name>BankWTB</bank-name>
        <country>US</country>
        <depositor>Sytsevichs Siarheis</depositor>
		<amount-on-deposit>100000</amount-on-deposit>
		<profitability>6.5</profitability>
		<time-constraints>2023-04-20</time-constraints>
		<date-until-replenishment-allowed>2023-03-20</date-until-replenishment-allowed>
	</accumulation-deposit>
    <checkin-deposit account-id="462050507008506966" withdrawal-callable="false">
		<bank-name>Paritetbank</bank-name>
        <country>RU</country>
        <depositor>Сыцевич Максим</depositor>
		<amount-on-deposit>100000</amount-on-deposit>
		<profitability>6.5</profitability>
		<time-constraints>2023-04-20</time-constraints>
		<irreducible-balance>1000</irreducible-balance>
    </checkin-deposit>
    <express-deposit account-id="462050507008506967" deposit-callable="false">
		<bank-name>BankBelWEB</bank-name>
        <country>BY</country>
        <depositor>Sytsevich Siarhei Vasilijevich</depositor>
		<amount-on-deposit>1000</amount-on-deposit>
		<profitability>0.000</profitability>
		<time-constraints>2023-04-20</time-constraints>
	</express-deposit>
</deposits>
